{
  "$schema": "http://json-schema.org/draft-04/schema#",
  "type": "array",
  "items": {
    "type": "object",
    "properties": {
      "dataPagamento": {
        "type": "string"
      },
      "formaPagamento": {
        "type": "object",
        "properties": {
          "pix": {
            "type": "string"
          },
          "boleto": {
            "type": "string"
          },
          "credito": {
            "type": "object",
            "properties": {
              "credito_status": {
                "type": "string"
              },
              "qteParcelas": {
                "type": "string"
              },
              "juros": {
                "type": "string"
              }
            }
          }
        }
      },
      "precoTotal": {
        "type": "string"
      },
      "quantidadeTotal": {
        "type": "string"
      },
      "idUsuario": {
        "type": "string"
      },
      "_id": {
        "type": "string"
      },
      "idPagamento": {
        "type": "string"
      }
    }
  }
}